title,year,source,authors,class,keywords,abstract,pdf_link,topic,google_scholar_link
DiGress: Discrete Denoising diffusion for graph generation,2023,ICLR,"['Clement Vignac', 'Igor Krawczuk', 'Antoine Siraudin', 'Bohan Wang', 'Volkan Cevher', 'Pascal Frossard']",poster,"['Graph generation', 'Denoising Diffusion Model', 'Molecule Generation', 'Permutation Equivariance', 'Discrete Diffusion']","This work introduces DiGress, a discrete denoising diffusion model for generating graphs with categorical node and edge attributes.
Our model utilizes a discrete diffusion process that progressively edits graphs with noise, through the process of adding or removing edges and changing the categories.
A graph transformer network is trained to revert this process, simplifying the problem of distribution learning over graphs into a sequence of node and edge classification tasks.
We further improve sample quality by introducing a Markovian noise model that preserves the marginal distribution of node and edge types during diffusion, and by incorporating auxiliary graph-theoretic features.
A procedure for conditioning the generation on graph-level features is also proposed.
DiGress achieves state-of-the-art performance on molecular and non-molecular datasets, with up to 3x validity improvement on a planar graph dataset. 
It is also the first model to scale to the large GuacaMol dataset containing 1.3M drug-like molecules without the use of molecule-specific representations.",https://api.openreview.net/pdf/ca5c988dd881d65b94fffbf35e0eaa5c5be23585.pdf,graph;transformer;representation;generative model;diffusion models,https://scholar.google.com/scholar?q=DiGress:+Discrete+Denoising+diffusion+for+graph+generation
DiffuSeq: Sequence to Sequence Text Generation with Diffusion Models,2023,ICLR,"['Shansan Gong', 'Mukai Li', 'Jiangtao Feng', 'Zhiyong Wu', 'Lingpeng Kong']",poster,"['diffusion model', 'sequence to sequence', 'text generation', 'diveristy']","Recently, diffusion models have emerged as a new paradigm for generative models. Despite the success in domains using continuous signals such as vision and audio, adapting diffusion models to natural language is under-explored due to the discrete nature of texts, especially for conditional generation. We tackle this challenge by proposing DiffuSeq: a diffusion model designed for sequence-to-sequence (Seq2Seq) text generation tasks. Upon extensive evaluation over a wide range of Seq2Seq tasks, we find DiffuSeq achieving comparable or even better performance than six established baselines, including a state-of-the-art model that is based on pre-trained language models. Apart from quality, an intriguing property of DiffuSeq is its high diversity during generation, which is desired in many Seq2Seq tasks. We further include a theoretical analysis revealing the connection between DiffuSeq and autoregressive/non-autoregressive models. Bringing together theoretical analysis and empirical evidence, we demonstrate the great potential of diffusion models in complex conditional language generation tasks. Code is available at https://github.com/Shark-NLP/DiffuSeq",https://api.openreview.net/pdf/60eecf7c181638fdfa60c671ca5d0b67644748cd.pdf,graph;generative model;diffusion models,https://scholar.google.com/scholar?q=DiffuSeq:+Sequence+to+Sequence+Text+Generation+with+Diffusion+Models
Equivariant Energy-Guided SDE for Inverse Molecular Design,2023,ICLR,"['Fan Bao', 'Min Zhao', 'Zhongkai Hao', 'Peiyao Li', 'Chongxuan Li', 'Jun Zhu']",poster,"['score-based model', 'diffusion model', 'inverse molecular design', 'energy guidance', 'molecule generation', 'equivariance']","Inverse molecular design is critical in material science and drug discovery, where the generated molecules should satisfy certain desirable properties. In this paper, we propose equivariant energy-guided stochastic differential equations (EEGSDE), a flexible framework for controllable 3D molecule generation under the guidance of an energy function in diffusion models. Formally, we show that EEGSDE naturally exploits the geometric symmetry in 3D molecular conformation, as long as the energy function is invariant to orthogonal transformations. Empirically, under the guidance of designed energy functions, EEGSDE significantly improves the baseline on QM9, in inverse molecular design targeted to quantum properties and molecular structures. Furthermore, EEGSDE is able to generate molecules with multiple target properties by combining the corresponding energy functions linearly.",https://api.openreview.net/pdf/7eccd68c8c19051056b77215ff617061615b0e5c.pdf,generative model;metric;diffusion models;3d,https://scholar.google.com/scholar?q=Equivariant+Energy-Guided+SDE+for+Inverse+Molecular+Design
Accelerating Guided Diffusion Sampling with Splitting Numerical Methods,2023,ICLR,"['Suttisak Wizadwongsa', 'Supasorn Suwajanakorn']",poster,"['Splitting Numerical Methods', 'Guided Diffusion Models']","Guided diffusion is a technique for conditioning the output of a diffusion model at sampling time without retraining the network for each specific task. However, one drawback of diffusion models, whether they are guided or unguided, is their slow sampling process. 
Recent techniques can accelerate unguided sampling by applying high-order numerical methods to the sampling process when viewed as differential equations. On the contrary, we discover that the same techniques do not work for guided sampling, and little has been explored about its acceleration. This paper explores the culprit of this problem and provides a solution based on operator splitting methods, motivated by our key finding that classical high-order numerical methods are unsuitable for the conditional function. Our proposed method can re-utilize the high-order methods for guided sampling and can generate images with the same quality as a 250-step DDIM baseline using 32-58% less sampling time on ImageNet256. 
We also demonstrate usage on a wide variety of conditional generation tasks, such as text-to-image generation, colorization, inpainting, and super-resolution.",https://api.openreview.net/pdf/b76de0f572f704575f927eccbbb6c0031f8b7427.pdf,zero_few-shot;generative model;diffusion models,https://scholar.google.com/scholar?q=Accelerating+Guided+Diffusion+Sampling+with+Splitting+Numerical+Methods
Blurring Diffusion Models,2023,ICLR,"['Emiel Hoogeboom', 'Tim Salimans']",poster,"['blurring', 'diffusion', 'generative model']","Recently, Rissanen et al., (2022) have presented a new type of diffusion process for generative modeling based on heat dissipation, or blurring, as an alternative to isotropic Gaussian diffusion. Here, we show that blurring can equivalently be defined through a Gaussian diffusion process with non-isotropic noise. In making this connection, we bridge the gap between inverse heat dissipation and denoising diffusion, and we shed light on the inductive bias that results from this modeling choice. Finally, we propose a generalized class of diffusion models that offers the best of both standard Gaussian denoising diffusion and inverse heat dissipation, which we call Blurring Diffusion Models. ",https://api.openreview.net/pdf/33c05b0bd300e12f24e2ac7a85f4716f5c4a9147.pdf,generative model;diffusion models,https://scholar.google.com/scholar?q=Blurring+Diffusion+Models
Generative Modelling with Inverse Heat Dissipation,2023,ICLR,"['Severi Rissanen', 'Markus Heinonen', 'Arno Solin']",poster,"['diffusion model', 'partial differential equation', 'inductive bias']","While diffusion models have shown great success in image generation, their noise-inverting generative process does not explicitly consider the structure of images, such as their inherent multi-scale nature. Inspired by diffusion models and the empirical success of coarse-to-fine modelling, we propose a new diffusion-like model that generates images through stochastically reversing the heat equation, a PDE that locally erases fine-scale information when run over the 2D plane of the image. We interpret the solution of the forward heat equation with constant additive noise as a variational approximation in the diffusion latent variable model. Our new model shows emergent qualitative properties not seen in standard diffusion models, such as disentanglement of overall colour and shape in images. Spectral analysis on natural images highlights connections to diffusion models and reveals an implicit coarse-to-fine inductive bias in them.",https://api.openreview.net/pdf/40788e42963a1dbec8dc274094381e704205a2be.pdf,generative model;diffusion models,https://scholar.google.com/scholar?q=Generative+Modelling+with+Inverse+Heat+Dissipation
Dual Diffusion Implicit Bridges for Image-to-Image Translation,2023,ICLR,"['Xuan Su', 'Jiaming Song', 'Chenlin Meng', 'Stefano Ermon']",poster,[],"Common image-to-image translation methods rely on joint training over data from both source and target domains. The training process requires concurrent access to both datasets, which hinders data separation and privacy protection; and existing models cannot be easily adapted for translation of new domain pairs. We present Dual Diffusion Implicit Bridges (DDIBs), an image translation method based on diffusion models, that circumvents training on domain pairs. Image translation with DDIBs relies on two diffusion models trained independently on each domain, and is a two-step process: DDIBs first obtain latent encodings for source images with the source diffusion model, and then decode such encodings using the target model to construct target images. Both steps are defined via ordinary differential equations (ODEs), thus the process is cycle consistent only up to discretization errors of the ODE solvers. Theoretically, we interpret DDIBs as concatenation of source to latent, and latent to target Schrodinger Bridges, a form of entropy-regularized optimal transport, to explain the efficacy of the method. Experimentally, we apply DDIBs on synthetic and high-resolution image datasets, to demonstrate their utility in a wide variety of translation tasks and their inherent optimal transport properties.",https://api.openreview.net/pdf/91f1c96de0279c81fb44166262ba54d69daf0fe4.pdf,diffusion models,https://scholar.google.com/scholar?q=Dual+Diffusion+Implicit+Bridges+for+Image-to-Image+Translation
Stable Target Field for Reduced Variance Score Estimation in Diffusion Models,2023,ICLR,"['Yilun Xu', 'Shangyuan Tong', 'Tommi S. Jaakkola']",poster,"['generative model', 'score-based models', 'diffusion models', 'variance reduction']","Diffusion models generate samples by reversing a fixed forward diffusion process. Despite already providing impressive empirical results, these diffusion models algorithms can be further improved by reducing the variance of the training targets in their denoising score-matching objective. We argue that the source of such variance lies in the handling of intermediate noise-variance scales, where multiple modes in the data affect the direction of reverse paths. We propose to remedy the problem by incorporating a reference batch which we use to calculate weighted conditional scores as more stable training targets. We show that the procedure indeed helps in the challenging intermediate regime by reducing (the trace of) the covariance of training targets. The new stable targets can be seen as trading bias for reduced variance, where the bias vanishes with increasing reference batch size. Empirically, we show that the new objective improves the image quality, stability, and training speed of various popular diffusion models across datasets with both general ODE and SDE solvers. When used in combination with EDM, our method yields a current SOTA FID of 1.90 with 35 network evaluations on the unconditional CIFAR-10 generation task. The code is available at https://github.com/Newbeeer/stf",https://api.openreview.net/pdf/bd21f9db32efdae84c04fffb45dc533162bb1809.pdf,graph;generative model;diffusion models,https://scholar.google.com/scholar?q=Stable+Target+Field+for+Reduced+Variance+Score+Estimation+in+Diffusion+Models
Markup-to-Image Diffusion Models with Scheduled Sampling,2023,ICLR,"['Yuntian Deng', 'Noriyuki Kojima', 'Alexander M Rush']",poster,[],"Building on recent advances in image generation, we present a fully data-driven approach to rendering markup into images. The approach is based on diffusion models, which parameterize the distribution of data using a sequence of denoising operations on top of a Gaussian noise distribution. We view the diffusion denoising process a sequential decision making process, and show that it exhibits compounding errors similar to exposure bias issues in imitation learning problems. To mitigate these issues, we adapt the scheduled sampling algorithm to diffusion training. We conduct experiments on four markup datasets: formulas (LaTeX), table layouts (HTML), sheet music (LilyPond), and molecular images (SMILES). These experiments each verify the effectiveness of diffusion and the use of scheduled sampling to fix generation issues. These results also show that the markup-to-image task presents a useful controlled compositional setting for diagnosing and analyzing generative image models.",https://api.openreview.net/pdf/f90b1cecbec20cb712499f3efdd915bf72fe7839.pdf,generative model;imitation learning;diffusion models,https://scholar.google.com/scholar?q=Markup-to-Image+Diffusion+Models+with+Scheduled+Sampling
Diffusion Probabilistic Fields,2023,ICLR,"['Peiye Zhuang', 'Samira Abnar', 'Jiatao Gu', 'Alex Schwing', 'Joshua M. Susskind', 'Miguel Ángel Bautista']",poster,"['Generative Models', 'Field Representation', 'Diffusion Models']","Diffusion probabilistic models have quickly become a major approach for generative modeling of images, 3D geometry, video and other domains. However, to adapt diffusion generative modeling to these domains the denoising network needs to be carefully designed for each domain independently, oftentimes under the assumption that data lives in a Euclidean grid. In this paper we introduce Diffusion Probabilistic Fields (DPF), a diffusion model that can learn distributions over continuous functions defined over metric spaces, commonly known as fields. We extend the formulation of diffusion probabilistic models to deal with this field parametrization in an explicit way, enabling us to define an end-to-end learning algorithm that side-steps the requirement of representing fields with latent vectors as in previous approaches (Dupont et al., 2022a; Du et al., 2021). We empirically show that, while using the same denoising network, DPF effectively deals with different modalities like 2D images and 3D geometry, in addition to modeling distributions over fields defined on non-Euclidean metric spaces.",https://api.openreview.net/pdf/73ebf3d9d08b88d3b59f24b690fe3f2584b6d628.pdf,generative model;metric;diffusion models;3d,https://scholar.google.com/scholar?q=Diffusion+Probabilistic+Fields
Novel View Synthesis with Diffusion Models,2023,ICLR,"['Daniel Watson', 'William Chan', 'Ricardo Martin Brualla', 'Jonathan Ho', 'Andrea Tagliasacchi', 'Mohammad Norouzi']",poster,"['3D', 'diffusion', 'ddpm', 'novel', 'view', 'synthesis', 'generative', 'models']","We present 3DiM (pronounced ""three-dim""), a diffusion model for 3D novel view synthesis from as few as a single image. The core of 3DiM is an image-to-image diffusion model -- 3DiM takes a single reference view and their poses as inputs, and generates a novel view via diffusion. 3DiM can then generate a full 3D consistent scene following our novel stochastic conditioning sampler: the output frames of the scene are generated autoregressively, and during the reverse diffusion process of each individual frame, we select a random conditioning frame from the set of previous frames at each denoising step. We demonstrate that stochastic conditioning yields much more 3D consistent results compared to the naive sampling process which only conditions on a single previous frame. We compare 3DiMs to prior work on the SRN ShapeNet dataset, demonstrating that 3DiM's generated videos from a single view achieve much higher fidelity while being approximately 3D consistent. We also introduce a new evaluation methodology, 3D consistency scoring, to measure the 3D consistency of a generated object by training a neural field on the model's output views. 3DiMs are geometry free, do not rely on hyper-networks or test-time optimization for novel view synthesis, and allow a single model to easily scale to a large number of scenes.",https://api.openreview.net/pdf/fa3c83b8ced74fdc2103d3de7774170ced113e61.pdf,optimization;zero_few-shot;diffusion models;3d,https://scholar.google.com/scholar?q=Novel+View+Synthesis+with+Diffusion+Models
Unified Discrete Diffusion for Simultaneous Vision-Language Generation,2023,ICLR,"['Minghui Hu', 'Chuanxia Zheng', 'Zuopeng Yang', 'Tat-Jen Cham', 'Heliang Zheng', 'Chaoyue Wang', 'Dacheng Tao', 'Ponnuthurai N. Suganthan']",poster,"['Multi-modal', 'Image generation', 'Image Caption.']","The recently developed discrete diffusion model performs extraordinarily well in generation tasks, especially in the text-to-image task, showing great potential for modeling multimodal signals. In this paper, we leverage these properties and present a unified multimodal generation model, which can perform text-based, image-based, and even vision-language simultaneous generation using a single model. Specifically, we unify the discrete diffusion process for multimodal signals by proposing a unified Markov transition matrix and a unified objective. Moreover, we design a multimodal mutual attention module to highlight the inter-modal linkages, which is vital for multimodal generation. Extensive experiments indicate that our proposed method can perform comparably to the state-of-the-art solutions in various generation tasks.",https://api.openreview.net/pdf/d386e35cf9491b25a9017b063c051ef1d750c527.pdf,transformer;generative model;multimodal;diffusion models;llm,https://scholar.google.com/scholar?q=Unified+Discrete+Diffusion+for+Simultaneous+Vision-Language+Generation
Analog Bits: Generating Discrete Data using Diffusion Models with Self-Conditioning,2023,ICLR,"['Ting Chen', 'Ruixiang ZHANG', 'Geoffrey Hinton']",poster,"['Diffusion Models', 'Discrete Data']","We present Bit Diffusion: a simple and generic approach for generating discrete data with continuous state and continuous time diffusion models. The main idea behind our approach is to first represent the discrete data as binary bits, and then train a continuous diffusion model to model these bits as real numbers which we call analog bits. To generate samples, the model first generates the analog bits, which are then thresholded to obtain the bits that represent the discrete variables. We further propose two simple techniques, namely Self-Conditioning and Asymmetric Time Intervals, which lead to a significant improvement in sample quality. Despite its simplicity, the proposed approach can achieve strong performance in both discrete image generation and image captioning tasks. For discrete image generation, we significantly improve previous state-of-the-art on both CIFAR-10 (which has 3K discrete 8-bit tokens) and ImageNet-64x64 (which has 12K discrete 8-bit tokens), outperforming the best autoregressive model in both sample quality (measured by FID) and efficiency. For image captioning on MS-COCO dataset, our approach achieves competitive results compared to autoregressive models.",https://api.openreview.net/pdf/a44a46ea8deb0fda30f91b5e7a0712d7544a462a.pdf,generative model;metric;diffusion models,https://scholar.google.com/scholar?q=Analog+Bits:+Generating+Discrete+Data+using+Diffusion+Models+with+Self-Conditioning
Discrete Contrastive Diffusion for Cross-Modal Music and Image Generation,2023,ICLR,"['Ye Zhu', 'Yu Wu', 'Kyle Olszewski', 'Jian Ren', 'Sergey Tulyakov', 'Yan Yan']",poster,"['Contrastive Diffusion', 'Conditioned Generations', 'Music Generation', 'Image Synthesis']","Diffusion probabilistic models (DPMs) have become a popular approach to conditional generation, due to their promising results and support for cross-modal synthesis. A key desideratum in conditional synthesis is to achieve high correspondence between the conditioning input and generated output. Most existing methods learn such relationships implicitly, by incorporating the prior into the variational lower bound. In this work, we take a different route---we explicitly enhance input-output connections by maximizing their mutual information. To this end, we introduce a Conditional Discrete Contrastive Diffusion (CDCD) loss and design two contrastive diffusion mechanisms to effectively incorporate it into the denoising process, combining the diffusion training and contrastive learning for the first time by connecting it with the conventional variational objectives. We demonstrate the efficacy of our approach in evaluations with diverse multimodal conditional synthesis tasks: dance-to-music generation, text-to-image synthesis, as well as class-conditioned image synthesis. On each, we enhance the input-output correspondence and achieve higher or competitive general synthesis quality. Furthermore, the proposed approach improves the convergence of diffusion models, reducing the number of required diffusion steps by more than 35% on two benchmarks, significantly increasing the inference speed.",https://api.openreview.net/pdf/d217aca9d2b4ac1be080c492bb9d4939061d6de7.pdf,zero_few-shot;generative model;contrastive learning;inference;multimodal;diffusion models,https://scholar.google.com/scholar?q=Discrete+Contrastive+Diffusion+for+Cross-Modal+Music+and+Image+Generation
Diffusion Probabilistic Modeling of Protein Backbones in 3D for the motif-scaffolding problem,2023,ICLR,"['Brian L. Trippe', 'Jason Yim', 'Doug Tischer', 'David Baker', 'Tamara Broderick', 'Regina Barzilay', 'Tommi S. Jaakkola']",poster,"['Diffusion Models', 'Sequential Monte Carlo', 'Protein Design', 'Geometric Deep Learning']","Construction of a scaffold structure that supports a desired motif, conferring protein function, shows promise for the design of vaccines and enzymes. But a general solution to this motif-scaffolding problem remains open. Current machine-learning techniques for scaffold design are either limited to unrealistically small scaffolds (up to length 20) or struggle to produce multiple diverse scaffolds. We propose to learn a distribution over diverse and longer protein backbone structures via an E(3)-equivariant graph neural network. We develop SMCDiff to efficiently sample scaffolds from this distribution conditioned on a given motif; our algorithm is the first to theoretically guarantee conditional samples from a diffusion model in the large-compute limit. We evaluate our designed backbones by how well they align with AlphaFold2-predicted structures. We show that our method can (1) sample scaffolds up to 80 residues and (2) achieve structurally diverse scaffolds for a fixed motif.",https://api.openreview.net/pdf/9674e0c41114fe41488ab7b7ea23289d7b213496.pdf,graph;diffusion models;3d,https://scholar.google.com/scholar?q=Diffusion+Probabilistic+Modeling+of+Protein+Backbones+in+3D+for+the+motif-scaffolding+problem
DreamFusion: Text-to-3D using 2D Diffusion,2023,ICLR,"['Ben Poole', 'Ajay Jain', 'Jonathan T. Barron', 'Ben Mildenhall']",oral,"['diffusion models', 'score-based generative models', 'NeRF', 'neural rendering', '3d synthesis']","Recent breakthroughs in text-to-image synthesis have been driven by diffusion models trained on billions of image-text pairs. Adapting this approach to 3D synthesis would require large-scale datasets of labeled 3D or multiview data and efficient architectures for denoising 3D data, neither of which currently exist. In this work, we circumvent these limitations by using a pretrained 2D text-to-image diffusion model to perform text-to-3D synthesis. We introduce a loss based on probability density distillation that enables the use of a 2D diffusion model as a prior for optimization of a parametric image generator. Using this loss in a DeepDream-like procedure, we optimize a randomly-initialized 3D model (a Neural Radiance Field, or NeRF) via gradient descent such that its 2D renderings from random angles achieve a low loss. The resulting 3D model of the given text can be viewed from any angle, relit by arbitrary illumination, or composited into any 3D environment. Our approach requires no 3D training data and no modifications to the image diffusion model, demonstrating the effectiveness of pretrained image diffusion models as priors.",https://api.openreview.net/pdf/fc5d88df1a06d30ae79fb23e87030f0fb2c8bd76.pdf,optimization;zero_few-shot;metric;distillation;diffusion models;3d,https://scholar.google.com/scholar?q=DreamFusion:+Text-to-3D+using+2D+Diffusion
